"60","Goose","2","2","3","Agents that are 4-cost and higher cannot be added to the Team this month.","true","Hero:false;Villain:false;On-Reveal:false;Ongoing:true;Move:false;Discard:false;Destroy:false;Vanilla:false;Avenger:false;Hydra:false;Fantastic Four:false;X-Men:false;Guardians of the Galaxy:false;Spider-Man Rogues Gallery:false;Resists Wounds:false;","false","false"
"61","Green Goblin","3","-3","3","A random Agent in either HQ is added to the opponent's Squad this month. If you control Green Goblin, instead choose an Agent in your HQ to add to your opponent's Squad this month. This Agent returns to its original faction at the end of the month.","true","Hero:false;Villain:true;On-Reveal:true;Ongoing:false;Move:false;Discard:false;Destroy:false;Vanilla:false;Avenger:false;Hydra:false;Fantastic Four:false;X-Men:false;Guardians of the Galaxy:false;Spider-Man Rogues Gallery:true;Resists Wounds:false;","false","false"
"62","Groot","3","4","1","All owned Guardians of the Galaxy (stationed or HQ) must be added to their owner's Team this month.","true","Hero:true;Villain:false;On-Reveal:true;Ongoing:false;Move:false;Discard:false;Destroy:false;Vanilla:false;Avenger:false;Hydra:false;Fantastic Four:false;X-Men:false;Guardians of the Galaxy:true;Spider-Man Rogues Gallery:false;Resists Wounds:false;","false","false"
"63","Hawkeye","1","1","1","Hawkeye launches a Raid on a random Location. If Black Widow, Captain America, Iron Man, Thor, and/or Hulk are Free Agents or on the same side as Hawkeye, those Agents join Hawkeye in the Raid. If you control Hawkeye, you choose the target Location.","true","Hero:true;Villain:false;On-Reveal:true;Ongoing:false;Move:false;Discard:false;Destroy:false;Vanilla:false;Avenger:true;Hydra:false;Fantastic Four:false;X-Men:false;Guardians of the Galaxy:false;Spider-Man Rogues Gallery:false;Resists Wounds:false;","false","false"
"64","Hazmat","2","2","3","All Actions cost 1 more Influence this month.","true","Hero:true;Villain:false;On-Reveal:true;Ongoing:false;Move:false;Discard:false;Destroy:false;Vanilla:false;Avenger:true;Hydra:false;Fantastic Four:false;X-Men:false;Guardians of the Galaxy:false;Spider-Man Rogues Gallery:false;Resists Wounds:false;","false","false"
"65","Heimdall","6","8","1","Move 4 random Agents to The Bifrost. If Agents are on opposite sides, a mock battle occurs. Cards are revealed in order of placement.","true","Hero:true;Villain:false;On-Reveal:true;Ongoing:false;Move:true;Discard:false;Destroy:false;Vanilla:false;Avenger:false;Hydra:false;Fantastic Four:false;X-Men:false;Guardians of the Galaxy:false;Spider-Man Rogues Gallery:false;Resists Wounds:false;","false","false"
"66","Hela","6","6","3","All Eliminated Agents become Mercs this month for their original owners. After this month, they return to the Grave.","true","Hero:false;Villain:true;On-Reveal:true;Ongoing:false;Move:false;Discard:true;Destroy:false;Vanilla:false;Avenger:false;Hydra:false;Fantastic Four:false;X-Men:false;Guardians of the Galaxy:false;Spider-Man Rogues Gallery:false;Resists Wounds:true;","false","false"
"67","Hellcow","4","6","3","Discarding does not inflict Wounds this month. If you control Hellcow, this Ploy only applies to you.","true","Hero:false;Villain:true;On-Reveal:false;Ongoing:false;Move:false;Discard:true;Destroy:false;Vanilla:false;Avenger:false;Hydra:false;Fantastic Four:false;X-Men:false;Guardians of the Galaxy:false;Spider-Man Rogues Gallery:false;Resists Wounds:false;","false","false"
"68","Hobgoblin","5","-8","2","Hobgoblin launches a Raid on a random Location. If Hobgoblin's side loses, all Agents on that side switch allegiance.","true","Hero:false;Villain:true;On-Reveal:true;Ongoing:false;Move:false;Discard:false;Destroy:false;Vanilla:false;Avenger:false;Hydra:false;Fantastic Four:false;X-Men:false;Guardians of the Galaxy:false;Spider-Man Rogues Gallery:true;Resists Wounds:false;","false","false"
"69","Hulk","6","12","1","If no player controls Hulk, both must Wound 12 POW worth of stationed Agents and destroy any locations those Agents are stationed in. If you control Hulk, this Ploy only affects your opponent.","true","Hero:true;Villain:false;On-Reveal:false;Ongoing:false;Move:false;Discard:false;Destroy:false;Vanilla:true;Avenger:true;Hydra:false;Fantastic Four:false;X-Men:false;Guardians of the Galaxy:false;Spider-Man Rogues Gallery:false;Resists Wounds:false;","false","false"
"70","Hulkbuster","3","4","1","Send away a random stationed 6-cost Agent from each side. If you control Hulkbuster, this Ploy only affects your opponent.","true","Hero:false;Villain:false;On-Reveal:true;Ongoing:false;Move:false;Discard:false;Destroy:false;Vanilla:false;Avenger:true;Hydra:false;Fantastic Four:false;X-Men:false;Guardians of the Galaxy:false;Spider-Man Rogues Gallery:false;Resists Wounds:false;","false","false"
"71","Human Torch","1","2","3","Move Agents cannot be Wounded or Captured this month. If you control Human Torch, this Ploy only applies to you.","true","Hero:true;Villain:false;On-Reveal:false;Ongoing:false;Move:true;Discard:false;Destroy:false;Vanilla:false;Avenger:true;Hydra:false;Fantastic Four:true;X-Men:false;Guardians of the Galaxy:false;Spider-Man Rogues Gallery:false;Resists Wounds:false;","false","true"
"72","Iceman","1","2","2","Freeze a random Location. That Location's effect is disabled this month, and Agents stationed there cannot be added to Teams. If you control Iceman, you may choose the Location.","true","Hero:true;Villain:false;On-Reveal:true;Ongoing:false;Move:false;Discard:false;Destroy:false;Vanilla:false;Avenger:false;Hydra:false;Fantastic Four:false;X-Men:true;Guardians of the Galaxy:false;Spider-Man Rogues Gallery:false;Resists Wounds:false;","false","false"
"73","Invisible Woman","2","3","3","Add ""shields"" to 3 random Locations. Those Locations cannot be destroyed this month, and Agents stationed there are immune to Events and Ploys. If you control Invisible Woman, you choose the 3 Locations.","true","Hero:true;Villain:false;On-Reveal:false;Ongoing:true;Move:false;Discard:false;Destroy:false;Vanilla:false;Avenger:false;Hydra:false;Fantastic Four:true;X-Men:false;Guardians of the Galaxy:false;Spider-Man Rogues Gallery:false;Resists Wounds:false;","false","false"
"74","Iron Fist","1","2","1","Move a random Free Agent to a random Location. If that Location is yours, the Agent becomes a Merc for you this month. If you control Iron Fist, you can choose a different Location.","true","Hero:true;Villain:false;On-Reveal:true;Ongoing:false;Move:true;Discard:false;Destroy:false;Vanilla:false;Avenger:false;Hydra:false;Fantastic Four:false;X-Men:false;Guardians of the Galaxy:false;Spider-Man Rogues Gallery:false;Resists Wounds:false;","false","false"
"75","Iron Man","5","0","1","If you control Iron Man, double your Influence this month. If neither Player controls Iron Man, halve Influence this month (rounding down).","true","Hero:true;Villain:false;On-Reveal:false;Ongoing:true;Move:false;Discard:false;Destroy:false;Vanilla:false;Avenger:true;Hydra:false;Fantastic Four:false;X-Men:false;Guardians of the Galaxy:false;Spider-Man Rogues Gallery:false;Resists Wounds:false;","false","false"
"76","Jane Foster","5","8","3","This month, Players may wager their remaining Influence during Battle. The winner of the Skirmish gets double their wager next month. The loser loses it that Influence next month.","true","Hero:true;Villain:false;On-Reveal:true;Ongoing:false;Move:false;Discard:false;Destroy:false;Vanilla:false;Avenger:true;Hydra:false;Fantastic Four:false;X-Men:false;Guardians of the Galaxy:false;Spider-Man Rogues Gallery:false;Resists Wounds:false;","false","false"
"77","Jessica Jones","4","4","1","This month, unspent Influence is retained until next month. If you control Jessica Jones, this Ploy only applies to you.","true","Hero:true;Villain:false;On-Reveal:true;Ongoing:false;Move:false;Discard:false;Destroy:false;Vanilla:false;Avenger:false;Hydra:false;Fantastic Four:false;X-Men:false;Guardians of the Galaxy:false;Spider-Man Rogues Gallery:false;Resists Wounds:false;","false","false"
"78","Jubilee","4","1","2","Each Player receives 2 random Mercs. If you control Jubilee, this Ploy only applies to you.","true","Hero:true;Villain:false;On-Reveal:true;Ongoing:false;Move:false;Discard:false;Destroy:false;Vanilla:false;Avenger:false;Hydra:false;Fantastic Four:false;X-Men:true;Guardians of the Galaxy:false;Spider-Man Rogues Gallery:false;Resists Wounds:false;","false","false"
"79","Juggernaut","3","3","3","Target one Location owned by each Player. Move Agents from those Locations to different random Locations owned by that Player (if possible). If you control Juggernaut, you may choose the targeted Locations.","true","Hero:false;Villain:true;On-Reveal:true;Ongoing:false;Move:true;Discard:false;Destroy:false;Vanilla:false;Avenger:false;Hydra:false;Fantastic Four:false;X-Men:true;Guardians of the Galaxy:false;Spider-Man Rogues Gallery:false;Resists Wounds:false;","false","false"
"80","Ka-Zar","4","4","1","All stationed 1-cost Agents must be added to the Team this month.","true","Hero:true;Villain:false;On-Reveal:false;Ongoing:true;Move:false;Discard:false;Destroy:false;Vanilla:false;Avenger:false;Hydra:false;Fantastic Four:false;X-Men:false;Guardians of the Galaxy:false;Spider-Man Rogues Gallery:false;Resists Wounds:false;","false","false"
"81","Killmonger","3","3","2","Wound all stationed 1-cost Agents. If you control Killmonger, this Ploy only targets your opponent.","true","Hero:false;Villain:true;On-Reveal:true;Ongoing:false;Move:false;Discard:false;Destroy:true;Vanilla:false;Avenger:false;Hydra:false;Fantastic Four:false;X-Men:false;Guardians of the Galaxy:false;Spider-Man Rogues Gallery:false;Resists Wounds:false;","false","false"
"82","Kingpin","3","4","3","All stationed Wounded Agents must be added to the Team this month.","true","Hero:false;Villain:true;On-Reveal:false;Ongoing:false;Move:true;Discard:false;Destroy:true;Vanilla:false;Avenger:false;Hydra:false;Fantastic Four:false;X-Men:false;Guardians of the Galaxy:false;Spider-Man Rogues Gallery:true;Resists Wounds:false;","false","false"
"83","Klaw","5","4","1","Steal 2 Cubes from one Player and give them to the other Player. If you control Klaw, you are the Player that receives the Cubes.","true","Hero:false;Villain:true;On-Reveal:false;Ongoing:true;Move:false;Discard:false;Destroy:false;Vanilla:false;Avenger:false;Hydra:false;Fantastic Four:false;X-Men:false;Guardians of the Galaxy:false;Spider-Man Rogues Gallery:false;Resists Wounds:false;","false","false"
"84","Korg","1","2","1","Players cannot Snap during the first battle this month.","true","Hero:true;Villain:false;On-Reveal:true;Ongoing:false;Move:false;Discard:false;Destroy:false;Vanilla:false;Avenger:false;Hydra:false;Fantastic Four:false;X-Men:false;Guardians of the Galaxy:false;Spider-Man Rogues Gallery:false;Resists Wounds:false;","false","false"
"85","Kraven","2","2","1","Both Players add an Agent from their HQ to their Team this month. Kraven randomly Wounds one of those Agents, chosen randomly. If you control Kraven, it will be your opponent's Agent.","true","Hero:false;Villain:true;On-Reveal:false;Ongoing:false;Move:true;Discard:false;Destroy:false;Vanilla:false;Avenger:false;Hydra:false;Fantastic Four:false;X-Men:false;Guardians of the Galaxy:false;Spider-Man Rogues Gallery:true;Resists Wounds:false;","false","false"
"86","Lady Sif","3","4","1","Wound one of the highest-cost stationed Agent controlled by each Player. If you control Lady Sif, this Ploy only affects your opponent.","true","Hero:true;Villain:false;On-Reveal:true;Ongoing:false;Move:false;Discard:true;Destroy:false;Vanilla:false;Avenger:false;Hydra:false;Fantastic Four:false;X-Men:false;Guardians of the Galaxy:false;Spider-Man Rogues Gallery:false;Resists Wounds:false;","false","false"
"87","Leader","6","2","3","Each Player names an Agent they do not own. If it is not controlled by the opponent, they may use it as a Merc this month. If you control Leader, you may name up to 3 Agents.","true","Hero:false;Villain:true;On-Reveal:true;Ongoing:false;Move:false;Discard:false;Destroy:false;Vanilla:false;Avenger:false;Hydra:false;Fantastic Four:false;X-Men:false;Guardians of the Galaxy:false;Spider-Man Rogues Gallery:false;Resists Wounds:false;","false","false"
"88","Leech","5","3","2","All Location Effects are negated this month.","true","Hero:true;Villain:false;On-Reveal:true;Ongoing:false;Move:false;Discard:false;Destroy:false;Vanilla:false;Avenger:false;Hydra:false;Fantastic Four:false;X-Men:false;Guardians of the Galaxy:false;Spider-Man Rogues Gallery:false;Resists Wounds:false;","false","false"
"89","Lizard","2","5","1","Fully occupied Locations do not count toward Influence this month. If you control Lizard, this Ploy only affects your opponent.","true","Hero:false;Villain:true;On-Reveal:false;Ongoing:true;Move:false;Discard:false;Destroy:false;Vanilla:false;Avenger:false;Hydra:false;Fantastic Four:false;X-Men:false;Guardians of the Galaxy:false;Spider-Man Rogues Gallery:true;Resists Wounds:false;","false","false"
"90","Lockjaw","3","2","3","This month, when players add an Agent to their Squad, it is swapped with a different random Agent from their HQ.","true","Hero:false;Villain:false;On-Reveal:false;Ongoing:false;Move:false;Discard:false;Destroy:false;Vanilla:false;Avenger:false;Hydra:false;Fantastic Four:false;X-Men:false;Guardians of the Galaxy:false;Spider-Man Rogues Gallery:false;Resists Wounds:false;","false","false"
"91","Luke Cage","2","2","3","Agents cannot be Captured this month. If you control Luke Cage, this Ploy only applies to you.","true","Hero:true;Villain:false;On-Reveal:false;Ongoing:true;Move:false;Discard:false;Destroy:false;Vanilla:false;Avenger:false;Hydra:false;Fantastic Four:true;X-Men:false;Guardians of the Galaxy:false;Spider-Man Rogues Gallery:false;Resists Wounds:false;","false","true"
"92","Magik","5","3","3","Both Players gain access to Limbo this month for stationing Agents and may do so now if eligible. No Raid occurs if both Players station Agents there, and neither Player gains ownership. If you control Magik, this Ploy only applies to you.","true","Hero:true;Villain:false;On-Reveal:true;Ongoing:false;Move:false;Discard:false;Destroy:false;Vanilla:false;Avenger:false;Hydra:false;Fantastic Four:false;X-Men:true;Guardians of the Galaxy:false;Spider-Man Rogues Gallery:false;Resists Wounds:false;","false","false"
"93","Magneto","6","12","3","Players cannot add 3 or 4-cost Agents to their Squad this month.","true","Hero:false;Villain:true;On-Reveal:true;Ongoing:false;Move:true;Discard:false;Destroy:false;Vanilla:false;Avenger:false;Hydra:false;Fantastic Four:false;X-Men:false;Guardians of the Galaxy:false;Spider-Man Rogues Gallery:false;Resists Wounds:false;","false","false"
"94","Mantis","1","2","1","Both Players gain a free Recruit. If you control Mantis, this only applies to you.","true","Hero:true;Villain:false;On-Reveal:true;Ongoing:false;Move:false;Discard:false;Destroy:false;Vanilla:false;Avenger:false;Hydra:false;Fantastic Four:false;X-Men:false;Guardians of the Galaxy:true;Spider-Man Rogues Gallery:false;Resists Wounds:false;","false","false"
"95","Maria Hill","2","3","3","Both Players receive a random 1-cost Agent as a Merc this month (if available). If you control Maria Hill, gain 2 instead.","true","Hero:true;Villain:false;On-Reveal:true;Ongoing:false;Move:false;Discard:false;Destroy:false;Vanilla:false;Avenger:false;Hydra:false;Fantastic Four:false;X-Men:false;Guardians of the Galaxy:false;Spider-Man Rogues Gallery:false;Resists Wounds:false;","false","false"
"96","Maximus","3","7","3","Enact 2 additional Character Ploys this month. If you control Maximus, you may see those two Ploys before confirming if you want to allow them.","true","Hero:false;Villain:true;On-Reveal:true;Ongoing:false;Move:false;Discard:false;Destroy:false;Vanilla:false;Avenger:false;Hydra:false;Fantastic Four:false;X-Men:false;Guardians of the Galaxy:false;Spider-Man Rogues Gallery:false;Resists Wounds:false;","false","false"
"97","Medusa","2","2","1","Unoccupied Locations count toward Influence this month. If you control Medusa, this Ploy only applies to you.","true","Hero:true;Villain:true;On-Reveal:true;Ongoing:false;Move:false;Discard:false;Destroy:false;Vanilla:false;Avenger:false;Hydra:false;Fantastic Four:true;X-Men:false;Guardians of the Galaxy:false;Spider-Man Rogues Gallery:false;Resists Wounds:false;","false","false"
"98","Mister Fantastic","3","2","1","Each Player gains 1 Cube for each member of the Fantastic Four they control. If you control Mister Fantastic, gain 2 Cubes for each instead.","true","Hero:true;Villain:false;On-Reveal:false;Ongoing:true;Move:false;Discard:false;Destroy:false;Vanilla:false;Avenger:true;Hydra:false;Fantastic Four:true;X-Men:false;Guardians of the Galaxy:false;Spider-Man Rogues Gallery:false;Resists Wounds:false;","false","false"
"99","Mister Negative","4","-1","3","Agents cannot be added to the Squad this month if their power exceeds their cost.","true","Hero:false;Villain:true;On-Reveal:true;Ongoing:false;Move:false;Discard:false;Destroy:false;Vanilla:false;Avenger:false;Hydra:false;Fantastic Four:false;X-Men:false;Guardians of the Galaxy:false;Spider-Man Rogues Gallery:true;Resists Wounds:false;","false","true"
"100","Mister Sinister","2","2","1","Mister Sinister and 2 random Free Agents launch a Raid on Sinister London. If you control Mister Sinister and that Location, you may choose a different Location to Raid, after seeing who the Free Agents are.","true","Hero:false;Villain:true;On-Reveal:true;Ongoing:false;Move:false;Discard:false;Destroy:false;Vanilla:false;Avenger:false;Hydra:false;Fantastic Four:false;X-Men:false;Guardians of the Galaxy:false;Spider-Man Rogues Gallery:false;Resists Wounds:false;","false","false"
"101","Misty Knight","1","2","1","Each Player takes control of a random unowned Location. If you control Misty Knight, this Ploy only applies to you.","true","Hero:true;Villain:false;On-Reveal:false;Ongoing:false;Move:false;Discard:false;Destroy:false;Vanilla:false;Avenger:false;Hydra:false;Fantastic Four:false;X-Men:false;Guardians of the Galaxy:false;Spider-Man Rogues Gallery:false;Resists Wounds:false;","false","false"
"102","Mojo","2","2","3","Only Agents in fully occupied Locations can be added to the Squad this month.","true","Hero:false;Villain:true;On-Reveal:false;Ongoing:true;Move:false;Discard:false;Destroy:false;Vanilla:false;Avenger:false;Hydra:false;Fantastic Four:false;X-Men:false;Guardians of the Galaxy:false;Spider-Man Rogues Gallery:false;Resists Wounds:false;","false","false"
"103","Moon Girl","4","4","1","Both players receive a Clone of an owned Agent of their choosing. If you control Moon Girl, this Ploy only applies to you.","true","Hero:true;Villain:false;On-Reveal:true;Ongoing:false;Move:false;Discard:false;Destroy:false;Vanilla:false;Avenger:false;Hydra:false;Fantastic Four:false;X-Men:false;Guardians of the Galaxy:false;Spider-Man Rogues Gallery:false;Resists Wounds:false;","false","false"
"104","Moon Knight","3","3","3","After Squads are formed, a random Agent in each Squad is wounded. If you control Moon Knight, this Ploy only affects your opponent.","true","Hero:false;Villain:false;On-Reveal:false;Ongoing:false;Move:false;Discard:true;Destroy:false;Vanilla:false;Avenger:true;Hydra:false;Fantastic Four:false;X-Men:false;Guardians of the Galaxy:false;Spider-Man Rogues Gallery:false;Resists Wounds:false;","false","false"
"105","Morbius","2","0","2","All stationed ""Discard"" Agents must be added to Squads this month.","true","Hero:false;Villain:true;On-Reveal:false;Ongoing:true;Move:false;Discard:true;Destroy:false;Vanilla:false;Avenger:false;Hydra:false;Fantastic Four:false;X-Men:false;Guardians of the Galaxy:false;Spider-Man Rogues Gallery:true;Resists Wounds:false;","false","false"
"106","Morph","3","0","1","Morph turns into a random Agent and activates that Agent's Ploy. If you control Morph, you control this Ploy.","true","Hero:true;Villain:false;On-Reveal:false;Ongoing:false;Move:false;Discard:false;Destroy:false;Vanilla:false;Avenger:true;Hydra:false;Fantastic Four:false;X-Men:true;Guardians of the Galaxy:false;Spider-Man Rogues Gallery:false;Resists Wounds:false;","false","false"
"107","Multiple Man","2","3","1","3 Multiple Man Clones Raid 3 random Locations. If you control Multiple Man, you can instead send the Clones to any Locations of your choosing.","true","Hero:true;Villain:false;On-Reveal:false;Ongoing:false;Move:true;Discard:false;Destroy:false;Vanilla:false;Avenger:false;Hydra:false;Fantastic Four:false;X-Men:true;Guardians of the Galaxy:false;Spider-Man Rogues Gallery:false;Resists Wounds:false;","false","false"
"108","Mysterio","2","4","3","Disguise this Ploy as a random other one. If you control Mysterio, you will be secretly informed. After Squads are formed, reveal this effect. All 2-Cost Agents in each Squad are swapped with random Agents from HQ.","true","Hero:false;Villain:true;On-Reveal:false;Ongoing:false;Move:false;Discard:false;Destroy:false;Vanilla:false;Avenger:false;Hydra:false;Fantastic Four:false;X-Men:false;Guardians of the Galaxy:false;Spider-Man Rogues Gallery:true;Resists Wounds:false;","false","false"
"109","Mystique","3","0","3","Each Player names an Ongoing Agent they do not own. That Player may use a Clone of that Agent as a Merc this month. If you control Mystique, this Ploy only applies to you.","true","Hero:true;Villain:false;On-Reveal:true;Ongoing:false;Move:false;Discard:false;Destroy:false;Vanilla:false;Avenger:false;Hydra:false;Fantastic Four:false;X-Men:true;Guardians of the Galaxy:false;Spider-Man Rogues Gallery:false;Resists Wounds:false;","false","false"
"110","Nakia","3","2","2","This month, Agents must be destroyed or discarded in two separate Battles to receive a Wound.","true","Hero:true;Villain:false;On-Reveal:true;Ongoing:false;Move:false;Discard:false;Destroy:false;Vanilla:false;Avenger:false;Hydra:false;Fantastic Four:false;X-Men:false;Guardians of the Galaxy:false;Spider-Man Rogues Gallery:false;Resists Wounds:false;","false","false"
"111","Namor","4","6","1","All Agents in Locations by themselves must be added to Squads this month.","true","Hero:false;Villain:false;On-Reveal:false;Ongoing:true;Move:false;Discard:false;Destroy:false;Vanilla:false;Avenger:true;Hydra:false;Fantastic Four:false;X-Men:false;Guardians of the Galaxy:false;Spider-Man Rogues Gallery:false;Resists Wounds:false;","false","false"
"112","Nick Fury","5","7","3","SHIELD gains 3 random Mercs this month. If HYDRA controls Nick Fury, a random SHIELD location is destroyed instead.","true","Hero:true;Villain:false;On-Reveal:true;Ongoing:false;Move:false;Discard:false;Destroy:false;Vanilla:false;Avenger:true;Hydra:false;Fantastic Four:false;X-Men:false;Guardians of the Galaxy:false;Spider-Man Rogues Gallery:false;Resists Wounds:false;","false","false"
"113","Nightcrawler","1","2","1","This month, Players may perform a ""Stealth Capture,"" informing The Watcher of your Capture without ending the Skirmish. The Agents are Captured at the end of the Skirmish. If you control Nightcrawler, this Ploy only applies to you.","true","Hero:true;Villain:false;On-Reveal:false;Ongoing:false;Move:true;Discard:false;Destroy:false;Vanilla:false;Avenger:false;Hydra:false;Fantastic Four:false;X-Men:true;Guardians of the Galaxy:false;Spider-Man Rogues Gallery:false;Resists Wounds:false;","false","false"
"114","Nova","1","1","1","If an Agent is Eliminated this month, the controller of that Agent gains 2 additional Influence next month, for each Eliminated Agent.","true","Hero:true;Villain:false;On-Reveal:false;Ongoing:false;Move:false;Discard:false;Destroy:true;Vanilla:false;Avenger:false;Hydra:false;Fantastic Four:false;X-Men:false;Guardians of the Galaxy:false;Spider-Man Rogues Gallery:false;Resists Wounds:true;","false","false"
"115","Odin","6","8","1","All stationed On-Reveal Agents must be added to the Squad, if possible.","true","Hero:true;Villain:false;On-Reveal:true;Ongoing:false;Move:false;Discard:false;Destroy:false;Vanilla:false;Avenger:false;Hydra:false;Fantastic Four:false;X-Men:false;Guardians of the Galaxy:false;Spider-Man Rogues Gallery:false;Resists Wounds:false;","false","false"
"116","Okoye","2","2","2","Any Agents added to your Squad this month have their Wounds healed immediately. If you control Okoye, this Ploy only applies to you.","true","Hero:true;Villain:false;On-Reveal:true;Ongoing:false;Move:false;Discard:false;Destroy:false;Vanilla:false;Avenger:false;Hydra:false;Fantastic Four:false;X-Men:false;Guardians of the Galaxy:false;Spider-Man Rogues Gallery:false;Resists Wounds:false;","false","false"
"117","Omega Red","4","5","3","Agents stationed in any Location with less than 4 total POW cannot be added to Squads this month.","true","Hero:false;Villain:true;On-Reveal:false;Ongoing:true;Move:false;Discard:false;Destroy:false;Vanilla:false;Avenger:false;Hydra:false;Fantastic Four:false;X-Men:false;Guardians of the Galaxy:false;Spider-Man Rogues Gallery:false;Resists Wounds:false;","false","false"
"118","Onslaught","6","7","1","All stationed Ongoing Agents must be added to the Squad, if possible.","true","Hero:false;Villain:true;On-Reveal:false;Ongoing:true;Move:false;Discard:false;Destroy:false;Vanilla:false;Avenger:false;Hydra:false;Fantastic Four:false;X-Men:false;Guardians of the Galaxy:false;Spider-Man Rogues Gallery:false;Resists Wounds:false;","false","false"
"119","Patriot","3","1","3","All controlled Vanilla Agents must be added to the Squad, including from HQ.","true","Hero:true;Villain:false;On-Reveal:false;Ongoing:true;Move:false;Discard:false;Destroy:false;Vanilla:false;Avenger:false;Hydra:false;Fantastic Four:false;X-Men:false;Guardians of the Galaxy:false;Spider-Man Rogues Gallery:false;Resists Wounds:false;","false","false"
