"120","Polaris","3","5","3","For every Action performed this month, Players must send one stationed Agent back to HQ. If you control Polaris, this Ploy only affects your opponent.","true","Hero:true;Villain:false;On-Reveal:true;Ongoing:false;Move:true;Discard:false;Destroy:false;Vanilla:false;Avenger:false;Hydra:false;Fantastic Four:false;X-Men:true;Guardians of the Galaxy:false;Spider-Man Rogues Gallery:false;Resists Wounds:false;","false","false"
"121","Professor X","5","3","1","Select a random Free Agent for each Player. Each Player may ask 10 questions about the chosen Agent that must be answered with ""yes"" or ""no."" After 10 questions, they may guess what the card is. If guessing correctly, they may recruit the Agent for free. If you control Professor X, you get 15 questions instead.","true","Hero:true;Villain:false;On-Reveal:false;Ongoing:true;Move:false;Discard:false;Destroy:false;Vanilla:false;Avenger:false;Hydra:false;Fantastic Four:false;X-Men:true;Guardians of the Galaxy:false;Spider-Man Rogues Gallery:false;Resists Wounds:true;","false","true"
"122","Psylocke","2","1","3","Next month, both Players receive one free Influence.","true","Hero:true;Villain:false;On-Reveal:true;Ongoing:false;Move:false;Discard:false;Destroy:false;Vanilla:false;Avenger:false;Hydra:false;Fantastic Four:false;X-Men:true;Guardians of the Galaxy:false;Spider-Man Rogues Gallery:false;Resists Wounds:false;","false","false"
"123","Quake","2","3","3","Swap the owners of two random Locations, including at least one owned by a Player, transferring stationed Agents to the new Locations. If you control Quake, one of the two Locations will be your opponent's.","true","Hero:true;Villain:false;On-Reveal:true;Ongoing:false;Move:false;Discard:false;Destroy:false;Vanilla:false;Avenger:true;Hydra:false;Fantastic Four:false;X-Men:false;Guardians of the Galaxy:false;Spider-Man Rogues Gallery:false;Resists Wounds:false;","false","false"
"124","Quicksilver","1","2","1","The first card you draw each Battle this month may be used as a Captain. If you control Quicksilver, this Ploy only applies to you.","true","Hero:true;Villain:false;On-Reveal:false;Ongoing:false;Move:false;Discard:false;Destroy:false;Vanilla:false;Avenger:true;Hydra:false;Fantastic Four:false;X-Men:false;Guardians of the Galaxy:false;Spider-Man Rogues Gallery:false;Resists Wounds:false;","false","false"
"125","Quinjet","1","2","3","Each Player may add an Agent directly from their HQ to their Squad. If you own Quinjet, this Ploy only applies to you.","true","Hero:false;Villain:false;On-Reveal:false;Ongoing:true;Move:false;Discard:false;Destroy:false;Vanilla:false;Avenger:true;Hydra:false;Fantastic Four:false;X-Men:false;Guardians of the Galaxy:false;Spider-Man Rogues Gallery:false;Resists Wounds:false;","false","false"
"126","Red Skull","5","12","3","HYDRA gains 1 Influence. If SHIELD controls Red Skull, SHIELD gains 1 Influence and HYDRA loses 1 Influence instead.","true","Hero:false;Villain:true;On-Reveal:false;Ongoing:true;Move:false;Discard:false;Destroy:false;Vanilla:false;Avenger:false;Hydra:true;Fantastic Four:false;X-Men:false;Guardians of the Galaxy:false;Spider-Man Rogues Gallery:false;Resists Wounds:false;","false","false"
"127","Rescue","4","4","3","Target a random Location with stationed Wounded Agent(s). Heal all Agents in that Location (prioritizes Locations with multiple Wounded Agents).","true","Hero:false;Villain:false;On-Reveal:false;Ongoing:false;Move:false;Discard:false;Destroy:false;Vanilla:false;Avenger:false;Hydra:false;Fantastic Four:false;X-Men:false;Guardians of the Galaxy:false;Spider-Man Rogues Gallery:false;Resists Wounds:false;","false","false"
"128","Rhino","3","3","3","Destroy a random owned Location. If you control Rhino, you choose the Location instead.","true","Hero:false;Villain:true;On-Reveal:true;Ongoing:false;Move:false;Discard:false;Destroy:false;Vanilla:false;Avenger:false;Hydra:false;Fantastic Four:false;X-Men:false;Guardians of the Galaxy:false;Spider-Man Rogues Gallery:true;Resists Wounds:false;","false","false"
"129","Rocket Raccoon","1","2","1","Rocket Raccoon launches a Raid against a random Location. If Groot is a Free Agent or on the same side, Groot joins Rocket. If you control Rocket, you choose the Location to Raid.","true","Hero:true;Villain:false;On-Reveal:true;Ongoing:false;Move:false;Discard:false;Destroy:false;Vanilla:false;Avenger:false;Hydra:false;Fantastic Four:false;X-Men:false;Guardians of the Galaxy:true;Spider-Man Rogues Gallery:false;Resists Wounds:false;","false","false"
"130","Rockslide","4","5","3","Players cannot Snap for the first two Skirmishes this month. If you control Rock Slide, this Ploy only affects your opponent.","true","Hero:true;Villain:false;On-Reveal:true;Ongoing:false;Move:false;Discard:false;Destroy:false;Vanilla:false;Avenger:false;Hydra:false;Fantastic Four:false;X-Men:true;Guardians of the Galaxy:false;Spider-Man Rogues Gallery:false;Resists Wounds:false;","false","false"
"131","Rogue","3","1","3","Each Player must give one of their Ongoing Agents to their opponent.","true","Hero:true;Villain:false;On-Reveal:true;Ongoing:false;Move:false;Discard:false;Destroy:false;Vanilla:false;Avenger:true;Hydra:false;Fantastic Four:false;X-Men:true;Guardians of the Galaxy:false;Spider-Man Rogues Gallery:false;Resists Wounds:false;","false","false"
"132","Ronan the Accuser","5","3","3","Reveal the Location of an Infinity Stone. If you control Ronan, it is revealed only to you.","true","Hero:false;Villain:true;On-Reveal:false;Ongoing:true;Move:false;Discard:false;Destroy:false;Vanilla:false;Avenger:false;Hydra:false;Fantastic Four:false;X-Men:false;Guardians of the Galaxy:false;Spider-Man Rogues Gallery:false;Resists Wounds:false;","false","false"
"133","Sabretooth","3","4","2","Players lose 1 Influence this month for each Wounded Agent in their HQ (min 0).","true","Hero:false;Villain:true;On-Reveal:false;Ongoing:false;Move:false;Discard:false;Destroy:true;Vanilla:false;Avenger:false;Hydra:false;Fantastic Four:false;X-Men:true;Guardians of the Galaxy:false;Spider-Man Rogues Gallery:false;Resists Wounds:true;","false","false"
"134","Sandman","5","3","2","Both players may perform only one Action this month.","true","Hero:false;Villain:true;On-Reveal:false;Ongoing:true;Move:false;Discard:false;Destroy:false;Vanilla:false;Avenger:false;Hydra:false;Fantastic Four:false;X-Men:false;Guardians of the Galaxy:false;Spider-Man Rogues Gallery:true;Resists Wounds:false;","false","false"
"135","Scarlet Witch","2","3","1","Both Players get a free Brainwashing this month. If you control Scarlet Witch, this Ploy only applies to you.","true","Hero:true;Villain:false;On-Reveal:true;Ongoing:false;Move:false;Discard:false;Destroy:false;Vanilla:false;Avenger:true;Hydra:false;Fantastic Four:false;X-Men:false;Guardians of the Galaxy:false;Spider-Man Rogues Gallery:false;Resists Wounds:false;","false","false"
"136","Scorpion","2","2","1","The first Agent added to each Player's Squad this month is Wounded. If you control Scorpion, this only affects your opponent.","true","Hero:false;Villain:true;On-Reveal:true;Ongoing:false;Move:false;Discard:false;Destroy:false;Vanilla:false;Avenger:false;Hydra:false;Fantastic Four:false;X-Men:false;Guardians of the Galaxy:false;Spider-Man Rogues Gallery:true;Resists Wounds:false;","false","false"
"137","Sentinel","2","3","1","Both Players must add Sentinel to their Squad, regardless who controls it.","true","Hero:false;Villain:true;On-Reveal:true;Ongoing:false;Move:false;Discard:false;Destroy:false;Vanilla:false;Avenger:false;Hydra:false;Fantastic Four:false;X-Men:false;Guardians of the Galaxy:false;Spider-Man Rogues Gallery:false;Resists Wounds:false;","false","false"
"138","Sera","5","4","3","This month, Actions cost 1 less Influence (min. 1).","true","Hero:true;Villain:false;On-Reveal:false;Ongoing:true;Move:false;Discard:false;Destroy:false;Vanilla:false;Avenger:false;Hydra:false;Fantastic Four:false;X-Men:false;Guardians of the Galaxy:false;Spider-Man Rogues Gallery:false;Resists Wounds:false;","false","false"
"139","Shang-Chi","4","3","2","Agents with 9+ POW cannot be added to the Squad this month.","true","Hero:true;Villain:false;On-Reveal:true;Ongoing:false;Move:false;Discard:false;Destroy:true;Vanilla:false;Avenger:true;Hydra:false;Fantastic Four:false;X-Men:false;Guardians of the Galaxy:false;Spider-Man Rogues Gallery:false;Resists Wounds:false;","false","false"
"140","She-Hulk","6","9","3","This month, each Player may use a Pool 4 or Pool 5 Agent of their choice as a Merc.","true","Hero:true;Villain:false;On-Reveal:false;Ongoing:false;Move:false;Discard:false;Destroy:false;Vanilla:false;Avenger:true;Hydra:false;Fantastic Four:true;X-Men:false;Guardians of the Galaxy:false;Spider-Man Rogues Gallery:false;Resists Wounds:false;","false","false"
"141","Shocker","2","3","1","Free a random Captured Agent. If you control Shocker, the Agent must be yours.","true","Hero:false;Villain:true;On-Reveal:false;Ongoing:false;Move:false;Discard:false;Destroy:false;Vanilla:true;Avenger:false;Hydra:false;Fantastic Four:false;X-Men:false;Guardians of the Galaxy:false;Spider-Man Rogues Gallery:true;Resists Wounds:false;","false","false"
"142","Spectrum","6","5","1","Locations cannot change ownership this month. If you control Spectrum, you may still obtain Locations this month.","true","Hero:true;Villain:false;On-Reveal:true;Ongoing:false;Move:false;Discard:false;Destroy:false;Vanilla:false;Avenger:true;Hydra:false;Fantastic Four:false;X-Men:false;Guardians of the Galaxy:false;Spider-Man Rogues Gallery:false;Resists Wounds:false;","false","false"
"143","Spider-Man","4","3","3","Spider-Man targets one random stationed Agent on each side and Captures them. If Spider-Man is a Free Agent, it occupies a random unowned Location to store the Captured Agents. Otherwise, you Capture a random Agent on the enemy side.","true","Hero:true;Villain:false;On-Reveal:true;Ongoing:false;Move:false;Discard:false;Destroy:false;Vanilla:false;Avenger:true;Hydra:false;Fantastic Four:true;X-Men:false;Guardians of the Galaxy:false;Spider-Man Rogues Gallery:false;Resists Wounds:false;","false","false"
"144","Spider-Woman","5","8","1","This month, both Players have 5 base Influence and lose 1 Influence for every 5 occupied Locations.","true","Hero:true;Villain:false;On-Reveal:true;Ongoing:false;Move:false;Discard:false;Destroy:false;Vanilla:false;Avenger:true;Hydra:false;Fantastic Four:false;X-Men:false;Guardians of the Galaxy:false;Spider-Man Rogues Gallery:false;Resists Wounds:false;","false","false"
"145","Squirrel Girl","1","1","1","Occupy all empty spaces in Locations with Squirrels. If you control Squirrel Girl, you may have this Ploy target only you, only your opponent, or neither.","true","Hero:true;Villain:false;On-Reveal:true;Ongoing:false;Move:false;Discard:false;Destroy:false;Vanilla:false;Avenger:false;Hydra:false;Fantastic Four:false;X-Men:false;Guardians of the Galaxy:false;Spider-Man Rogues Gallery:false;Resists Wounds:false;","false","false"
"146","Star-Lord","2","2","1","Unowned Guardians of the Galaxy become Mercs for both Players this month. If you control Star-Lord, they become Mercs for you only.","true","Hero:true;Villain:false;On-Reveal:true;Ongoing:false;Move:false;Discard:false;Destroy:false;Vanilla:false;Avenger:false;Hydra:false;Fantastic Four:false;X-Men:false;Guardians of the Galaxy:true;Spider-Man Rogues Gallery:false;Resists Wounds:false;","false","false"
"147","Storm","3","2","2","Destroy 3 random Locations. If you control Storm, this Ploy cannot target your Locations.","true","Hero:true;Villain:false;On-Reveal:true;Ongoing:false;Move:false;Discard:false;Destroy:false;Vanilla:false;Avenger:true;Hydra:false;Fantastic Four:true;X-Men:true;Guardians of the Galaxy:false;Spider-Man Rogues Gallery:false;Resists Wounds:false;","false","false"
"148","Strong Guy","4","4","1","The winner of this month's Skirmish gains 5 additional Cubes.","true","Hero:true;Villain:false;On-Reveal:false;Ongoing:true;Move:false;Discard:false;Destroy:false;Vanilla:false;Avenger:false;Hydra:false;Fantastic Four:false;X-Men:true;Guardians of the Galaxy:false;Spider-Man Rogues Gallery:false;Resists Wounds:false;","false","false"
"149","Sunspot","1","0","2","This month, players gain 1 random Merc for each unspent Influence.","true","Hero:true;Villain:false;On-Reveal:false;Ongoing:false;Move:false;Discard:false;Destroy:false;Vanilla:false;Avenger:false;Hydra:false;Fantastic Four:false;X-Men:true;Guardians of the Galaxy:false;Spider-Man Rogues Gallery:false;Resists Wounds:false;","false","false"
"150","Swarm","2","3","2","This month Wounded Agents, may be added directly from HQ to the Squad.","true","Hero:false;Villain:true;On-Reveal:false;Ongoing:false;Move:false;Discard:true;Destroy:false;Vanilla:false;Avenger:false;Hydra:false;Fantastic Four:false;X-Men:false;Guardians of the Galaxy:false;Spider-Man Rogues Gallery:true;Resists Wounds:true;","false","false"
"151","Sword Master","3","6","1","Sword Master launches a Raid on a random Location. Only one Agent may participate on the defense (defender's choice). If you control Sword Master, you choose the Location.","true","Hero:true;Villain:false;On-Reveal:true;Ongoing:false;Move:false;Discard:true;Destroy:false;Vanilla:false;Avenger:false;Hydra:false;Fantastic Four:false;X-Men:false;Guardians of the Galaxy:false;Spider-Man Rogues Gallery:false;Resists Wounds:false;","false","false"
"152","Taskmaster","5","0","3","The Watcer selects a random Free Agent. Reveal information about this Agent one clue at a time. The first player to guess the identity of the Free Agent may use this Agent as a Merc this month. If you control Taskmaster, you may activate this Ploy a second time.","true","Hero:false;Villain:false;On-Reveal:true;Ongoing:false;Move:false;Discard:false;Destroy:false;Vanilla:false;Avenger:false;Hydra:false;Fantastic Four:false;X-Men:false;Guardians of the Galaxy:false;Spider-Man Rogues Gallery:false;Resists Wounds:false;","false","false"
"153","The Collector","2","2","2","This month, you can only add stationed Agents to your deck if they have been upgraded to Infinity.","true","Hero:false;Villain:false;On-Reveal:false;Ongoing:false;Move:false;Discard:false;Destroy:false;Vanilla:false;Avenger:false;Hydra:false;Fantastic Four:false;X-Men:false;Guardians of the Galaxy:false;Spider-Man Rogues Gallery:false;Resists Wounds:false;","false","false"
"154","The Hood","1","-2","3","Select a random Location. Raid the Location with a Demon, plus an additional Demon for each empty Space in that Location. If you control The Hood, you choose the Location.","true","Hero:false;Villain:true;On-Reveal:true;Ongoing:false;Move:false;Discard:false;Destroy:false;Vanilla:false;Avenger:false;Hydra:false;Fantastic Four:false;X-Men:false;Guardians of the Galaxy:false;Spider-Man Rogues Gallery:false;Resists Wounds:false;","false","false"
"155","The Infinaut","6","20","2","This month, Squads have a 40-POW minimum.","true","Hero:false;Villain:false;On-Reveal:false;Ongoing:false;Move:false;Discard:false;Destroy:false;Vanilla:false;Avenger:false;Hydra:false;Fantastic Four:false;X-Men:false;Guardians of the Galaxy:false;Spider-Man Rogues Gallery:false;Resists Wounds:false;","false","false"
"156","Punisher","3","2","1","When a Player snaps this month, one of their Agents is randomly Wounded. If you control The Punisher, this Ploy only applies to your opponent.","true","Hero:false;Villain:false;On-Reveal:false;Ongoing:true;Move:false;Discard:false;Destroy:false;Vanilla:false;Avenger:false;Hydra:false;Fantastic Four:false;X-Men:false;Guardians of the Galaxy:false;Spider-Man Rogues Gallery:false;Resists Wounds:false;","false","false"
"157","The Thing","4","6","1","Vanilla Agents can be used as Captains this month. If you control Thing, this Ploy only applies to you.","true","Hero:true;Villain:false;On-Reveal:false;Ongoing:false;Move:false;Discard:false;Destroy:false;Vanilla:true;Avenger:false;Hydra:false;Fantastic Four:true;X-Men:false;Guardians of the Galaxy:false;Spider-Man Rogues Gallery:false;Resists Wounds:false;","false","false"
"158","Thor","3","4","3","Add Mjolnr to a random unowned Location. A Player cannot gain that Location unless the Player controls Thor.","true","Hero:true;Villain:false;On-Reveal:true;Ongoing:false;Move:false;Discard:false;Destroy:false;Vanilla:false;Avenger:true;Hydra:false;Fantastic Four:false;X-Men:false;Guardians of the Galaxy:false;Spider-Man Rogues Gallery:false;Resists Wounds:false;","false","false"
"159","Titania","1","5","3","One stationed Agent from each Player moves to an opponent's owned Location, if there is space. If they do, they change allegiance. If you control Titania, this Ploy only affects your opponent.","true","Hero:false;Villain:true;On-Reveal:false;Ongoing:false;Move:false;Discard:false;Destroy:false;Vanilla:false;Avenger:false;Hydra:false;Fantastic Four:false;X-Men:false;Guardians of the Galaxy:false;Spider-Man Rogues Gallery:false;Resists Wounds:false;","false","false"
"160","Typhoid Mary","4","10","3","Both Players lose 1 Influence this month. If you control Typhoid Mary, this Ploy only affects your opponent.","true","Hero:false;Villain:true;On-Reveal:false;Ongoing:true;Move:false;Discard:false;Destroy:false;Vanilla:false;Avenger:false;Hydra:false;Fantastic Four:false;X-Men:false;Guardians of the Galaxy:false;Spider-Man Rogues Gallery:false;Resists Wounds:false;","false","false"
"161","Uatu the Watcher","1","2","1","Both players see each other’s Squads after Assemble. If you control Uatu the Watcher, only you see your opponent’s Squad.","true","Hero:false;Villain:false;On-Reveal:false;Ongoing:false;Move:false;Discard:false;Destroy:false;Vanilla:false;Avenger:false;Hydra:false;Fantastic Four:false;X-Men:false;Guardians of the Galaxy:false;Spider-Man Rogues Gallery:false;Resists Wounds:false;","false","false"
"162","Ultron","6","8","3","Launch a Raid on a random Location using 8 Drones. If you control Ultron, you may target any number of Locations to send the Drones.","true","Hero:false;Villain:true;On-Reveal:true;Ongoing:false;Move:false;Discard:false;Destroy:false;Vanilla:false;Avenger:false;Hydra:false;Fantastic Four:false;X-Men:false;Guardians of the Galaxy:false;Spider-Man Rogues Gallery:false;Resists Wounds:false;","false","false"
"163","Venom","3","3","3","All stationed ""Destroy"" Agents must be added to the Squad this month.","true","Hero:false;Villain:true;On-Reveal:true;Ongoing:false;Move:false;Discard:false;Destroy:true;Vanilla:false;Avenger:false;Hydra:false;Fantastic Four:false;X-Men:false;Guardians of the Galaxy:false;Spider-Man Rogues Gallery:true;Resists Wounds:false;","false","false"
"164","Viper","2","3","3","Send an Agent from a random Location to an empty space in an opponent's random Location and perform a Raid. If you control Viper, you choose which Agent to send to an opponent's empty space.","true","Hero:false;Villain:true;On-Reveal:true;Ongoing:false;Move:false;Discard:false;Destroy:false;Vanilla:false;Avenger:false;Hydra:true;Fantastic Four:false;X-Men:false;Guardians of the Galaxy:false;Spider-Man Rogues Gallery:false;Resists Wounds:false;","false","true"
"165","Vision","5","7","2","Each Player may station an Agent from HQ in an unowned Location. If you control Vision, this Ploy only applies to you.","true","Hero:true;Villain:false;On-Reveal:false;Ongoing:false;Move:true;Discard:false;Destroy:false;Vanilla:false;Avenger:false;Hydra:false;Fantastic Four:false;X-Men:false;Guardians of the Galaxy:false;Spider-Man Rogues Gallery:false;Resists Wounds:false;","false","false"
"166","Vulture","3","3","2","All stationed ""Move"" Agents must be added to the Squad, if possible.","true","Hero:false;Villain:true;On-Reveal:false;Ongoing:false;Move:true;Discard:false;Destroy:false;Vanilla:false;Avenger:false;Hydra:false;Fantastic Four:false;X-Men:false;Guardians of the Galaxy:false;Spider-Man Rogues Gallery:true;Resists Wounds:false;","false","false"
"167","Warpath","4","5","2","This month, whichever side occupies fewer Locations gains 1 additional Influence. If a tie, both sides gain the Influence.","true","Hero:true;Villain:false;On-Reveal:false;Ongoing:true;Move:false;Discard:false;Destroy:false;Vanilla:false;Avenger:false;Hydra:false;Fantastic Four:false;X-Men:true;Guardians of the Galaxy:false;Spider-Man Rogues Gallery:false;Resists Wounds:false;","false","false"
"168","Wasp","0","1","3","This month, Squads have a max total cost of 10.","true","Hero:true;Villain:false;On-Reveal:false;Ongoing:false;Move:false;Discard:false;Destroy:false;Vanilla:true;Avenger:true;Hydra:false;Fantastic Four:false;X-Men:false;Guardians of the Galaxy:false;Spider-Man Rogues Gallery:false;Resists Wounds:false;","false","false"
"169","Wave","3","3","3","Both players have 3 Influence this month.","true","Hero:true;Villain:false;On-Reveal:true;Ongoing:false;Move:false;Discard:false;Destroy:false;Vanilla:false;Avenger:false;Hydra:false;Fantastic Four:false;X-Men:false;Guardians of the Galaxy:false;Spider-Man Rogues Gallery:false;Resists Wounds:false;","false","false"
"170","White Queen","4","6","1","Both Players may use a Clone of a random stationed Agent owned by their opponent in their Squad this month. These Agents are only revealed to the Player receiving them. If you control White Queen, this Ploy only applies to you.","true","Hero:true;Villain:false;On-Reveal:true;Ongoing:false;Move:false;Discard:false;Destroy:false;Vanilla:false;Avenger:false;Hydra:false;Fantastic Four:false;X-Men:true;Guardians of the Galaxy:false;Spider-Man Rogues Gallery:false;Resists Wounds:false;","false","false"
"171","White Tiger","5","1","1","A Tiger Spirit launches a Raid on a random Location. If you control White Tiger, you choose the target Location.","true","Hero:true;Villain:false;On-Reveal:true;Ongoing:false;Move:false;Discard:false;Destroy:false;Vanilla:false;Avenger:true;Hydra:false;Fantastic Four:false;X-Men:false;Guardians of the Galaxy:false;Spider-Man Rogues Gallery:false;Resists Wounds:false;","false","false"
"172","Wolfsbane","3","1","1","The Player with more stationed Agents this month may immediately station an additional 3 Agents, ignoring space limits.","true","Hero:true;Villain:false;On-Reveal:true;Ongoing:false;Move:false;Discard:false;Destroy:false;Vanilla:false;Avenger:false;Hydra:false;Fantastic Four:false;X-Men:true;Guardians of the Galaxy:false;Spider-Man Rogues Gallery:false;Resists Wounds:false;","false","false"
"173","Wolverine","2","2","1","Deploy all Wounded Agents to available empty spaces in owned Locations, if possible. If you control Wolverine, you may ignore this Ploy.","true","Hero:true;Villain:false;On-Reveal:false;Ongoing:false;Move:false;Discard:true;Destroy:true;Vanilla:false;Avenger:false;Hydra:false;Fantastic Four:false;X-Men:true;Guardians of the Galaxy:false;Spider-Man Rogues Gallery:false;Resists Wounds:true;","false","false"
"174","Wong","4","2","3","Summon 2 random Free Agents to Raid a random Location. If you control Wong, you choose the target Location.","true","Hero:true;Villain:false;On-Reveal:false;Ongoing:true;Move:false;Discard:false;Destroy:false;Vanilla:false;Avenger:false;Hydra:false;Fantastic Four:false;X-Men:false;Guardians of the Galaxy:false;Spider-Man Rogues Gallery:false;Resists Wounds:false;","false","false"
"175","Yellowjacket","0","2","3","Agents cannot be added to your Squad this month if their cost exceeds their POW.","true","Hero:false;Villain:true;On-Reveal:true;Ongoing:false;Move:false;Discard:false;Destroy:false;Vanilla:false;Avenger:false;Hydra:false;Fantastic Four:false;X-Men:false;Guardians of the Galaxy:false;Spider-Man Rogues Gallery:false;Resists Wounds:false;","false","false"
"176","Yondu","1","2","1","Eliminate a random Free Agent.","true","Hero:false;Villain:false;On-Reveal:true;Ongoing:false;Move:false;Discard:false;Destroy:true;Vanilla:false;Avenger:false;Hydra:false;Fantastic Four:false;X-Men:false;Guardians of the Galaxy:true;Spider-Man Rogues Gallery:false;Resists Wounds:false;","false","false"
"177","Zero","1","3","3","No Character Ploys occur this month.","true","Hero:true;Villain:false;On-Reveal:true;Ongoing:false;Move:false;Discard:false;Destroy:false;Vanilla:false;Avenger:false;Hydra:false;Fantastic Four:false;X-Men:false;Guardians of the Galaxy:false;Spider-Man Rogues Gallery:false;Resists Wounds:false;","false","false"
"178","Helicarrier","6","10","3","Each player may Wound one of their stationed Agents to gain 3 Mercs this month. If you control Helicarrier, this Ploy only applies to you.","true","Hero:false;Villain:false;On-Reveal:false;Ongoing:false;Move:false;Discard:true;Destroy:false;Vanilla:false;Avenger:true;Hydra:false;Fantastic Four:false;X-Men:false;Guardians of the Galaxy:false;Spider-Man Rogues Gallery:false;Resists Wounds:true;","false","false"
"179","Ironheart","3","0","1","Target 3 random Wounded Agents in either Faction. Heal their Wounds. If you control Ironheart, only applies to you. ","true","Hero:true;Villain:false;On-Reveal:true;Ongoing:false;Move:false;Discard:false;Destroy:false;Vanilla:false;Avenger:false;Hydra:false;Fantastic Four:false;X-Men:false;Guardians of the Galaxy:false;Spider-Man Rogues Gallery:false;Resists Wounds:false;","false","false"
"180","Miles Morales","4","5","3","This month, you may only add stationed Agents to your Squad by using their Variants.","true","Hero:true;Villain:false;On-Reveal:false;Ongoing:false;Move:true;Discard:false;Destroy:false;Vanilla:false;Avenger:true;Hydra:false;Fantastic Four:false;X-Men:false;Guardians of the Galaxy:false;Spider-Man Rogues Gallery:false;Resists Wounds:false;","false","false"
