"181","M'Baku","1","2","3","M’Baku is added to a random Squad. If you control M’Baku, this card is added to your opponent’s Squad this month.","true","Hero:false;Villain:true;On-Reveal:false;Ongoing:false;Move:false;Discard:false;Destroy:false;Vanilla:false;Avenger:false;Hydra:false;Fantastic Four:false;X-Men:false;Guardians of the Galaxy:false;Spider-Man Rogues Gallery:false;Resists Wounds:false;","false","false"
"182","Orka","6","11","3","This month, Locations can be Seized if you win a Raid using one Agent.","true","Hero:false;Villain:true;On-Reveal:false;Ongoing:true;Move:false;Discard:false;Destroy:false;Vanilla:false;Avenger:false;Hydra:false;Fantastic Four:false;X-Men:false;Guardians of the Galaxy:false;Spider-Man Rogues Gallery:false;Resists Wounds:false;","false","false"
"183","Attuma","4","10","3","This month, the Agent(s) with the highest POW placed in either Squad cannot be Wounded. (Inform only the owner(s) of their own Agents.)","true","Hero:false;Villain:true;On-Reveal:false;Ongoing:false;Move:false;Discard:false;Destroy:true;Vanilla:false;Avenger:false;Hydra:false;Fantastic Four:false;X-Men:false;Guardians of the Galaxy:false;Spider-Man Rogues Gallery:false;Resists Wounds:false;","false","false"
"184","Bast","1","1","3","This month, all stationed Agents with less than 3 POW must be added to the Squad.","true","Hero:false;Villain:false;On-Reveal:true;Ongoing:false;Move:false;Discard:false;Destroy:false;Vanilla:false;Avenger:false;Hydra:false;Fantastic Four:false;X-Men:false;Guardians of the Galaxy:false;Spider-Man Rogues Gallery:false;Resists Wounds:false;","false","false"
"185","Valkyrie","5","3","3","All stationed Agents with 3 POW must be added to the Squad this month.","true","Hero:true;Villain:false;On-Reveal:true;Ongoing:false;Move:false;Discard:false;Destroy:false;Vanilla:false;Avenger:false;Hydra:false;Fantastic Four:false;X-Men:false;Guardians of the Galaxy:false;Spider-Man Rogues Gallery:false;Resists Wounds:false;","false","false"
"186","Black Panther","5","4","3","Both Factions double their Influence this month.","true","Hero:true;Villain:false;On-Reveal:true;Ongoing:false;Move:false;Discard:false;Destroy:false;Vanilla:false;Avenger:true;Hydra:false;Fantastic Four:true;X-Men:false;Guardians of the Galaxy:false;Spider-Man Rogues Gallery:false;Resists Wounds:false;","false","false"
"187","Super-Skrull","4","2","3","Stationed Ongoing Agents provide +1 IP this month. If you control Super-Skrull, this effect only applies to you.","true","Hero:false;Villain:true;On-Reveal:false;Ongoing:true;Move:false;Discard:false;Destroy:false;Vanilla:false;Avenger:false;Hydra:false;Fantastic Four:false;X-Men:false;Guardians of the Galaxy:false;Spider-Man Rogues Gallery:false;Resists Wounds:false;","false","false"
"188","Shuri","4","2","3","Both players may immediately heal one of their Agent's Wounds. If you control Shuri, this effect only applies to you.","true","Hero:true;Villain:false;On-Reveal:true;Ongoing:false;Move:false;Discard:false;Destroy:false;Vanilla:false;Avenger:true;Hydra:false;Fantastic Four:false;X-Men:false;Guardians of the Galaxy:false;Spider-Man Rogues Gallery:false;Resists Wounds:false;","false","false"
"189","Kitty Pryde","1","0","3","Both players may return 3 of their Agents to HQ and station 1 Agent for each one returned. If you control Kitty Pryde, this effect only applies to you.","true","Hero:true;Villain:false;On-Reveal:false;Ongoing:false;Move:false;Discard:false;Destroy:false;Vanilla:false;Avenger:false;Hydra:false;Fantastic Four:false;X-Men:true;Guardians of the Galaxy:false;Spider-Man Rogues Gallery:false;Resists Wounds:false;","false","true"
"190","Shadow King","3","3","3","Players cannot gain Influence from Locations this month. If you control Shadow King, this effect only applies to your opponent.","true","Hero:false;Villain:true;On-Reveal:true;Ongoing:false;Move:false;Discard:false;Destroy:false;Vanilla:false;Avenger:false;Hydra:false;Fantastic Four:false;X-Men:false;Guardians of the Galaxy:false;Spider-Man Rogues Gallery:false;Resists Wounds:false;","false","false"
"191","Silver Surfer","3","2","3","All stationed 3-cost Agents must be added to both Teams this month.","true","Hero:false;Villain:false;On-Reveal:true;Ongoing:false;Move:false;Discard:false;Destroy:false;Vanilla:false;Avenger:false;Hydra:false;Fantastic Four:false;X-Men:false;Guardians of the Galaxy:false;Spider-Man Rogues Gallery:false;Resists Wounds:false;","false","false"
"192","Dazzler","4","4","3","Both Players may fully occupy all of their Locations, ignoring restrictions. If you control Dazzler, this effect only applies to you.","true","Hero:true;Villain:false;On-Reveal:false;Ongoing:true;Move:false;Discard:false;Destroy:false;Vanilla:false;Avenger:false;Hydra:false;Fantastic Four:false;X-Men:true;Guardians of the Galaxy:false;Spider-Man Rogues Gallery:false;Resists Wounds:false;","false","false"
"193","Ghost","1","2","3","This month, neither Player can Investigate. If you control Ghost, this effect only applies to your opponent.","true","Hero:false;Villain:false;On-Reveal:false;Ongoing:true;Move:false;Discard:false;Destroy:false;Vanilla:false;Avenger:false;Hydra:false;Fantastic Four:false;X-Men:false;Guardians of the Galaxy:false;Spider-Man Rogues Gallery:false;Resists Wounds:false;","false","false"
"194","Sauron","3","3","3","This month, players must spend 1 Influence to add an Ongoing Agent to their Squad. If you control Sauron, this effect only applies to your opponent.","true","Hero:false;Villain:true;On-Reveal:true;Ongoing:false;Move:false;Discard:false;Destroy:false;Vanilla:false;Avenger:false;Hydra:false;Fantastic Four:false;X-Men:false;Guardians of the Galaxy:false;Spider-Man Rogues Gallery:false;Resists Wounds:false;","false","false"
"195","Sentry","4","10","3","Sentry launches a Raid on a random owned Location. If there is space, add The Void to it on the defense’s side.","true","Hero:true;Villain:false;On-Reveal:true;Ongoing:false;Move:false;Discard:false;Destroy:false;Vanilla:false;Avenger:true;Hydra:false;Fantastic Four:false;X-Men:false;Guardians of the Galaxy:false;Spider-Man Rogues Gallery:false;Resists Wounds:false;","false","false"
